[
  {
    "schema_version": "0.1.0",
    "inspection_uuid": "7b6f60b2-e642-5434-854b-48f91f4a87f8",
    "establishment_uuid": "078e3c47-74f3-5788-bc75-daa69796bd7f",
    "source": "albuquerque_city",
    "source_inspection_id": "PT0152389|2026-10-15|RT-FOODEST-010728-2025",
    "source_establishment_id": "PT0152389",
    "restaurant_name": "ALBUQUERQUE UPTOWN ASSISTED LIVING",
    "address": {
      "street": "7611 INDIAN SCHOOL RD NE",
      "city": "Albuquerque",
      "state": "NM",
      "postal_code": null
    },
    "inspection_date": "2026-10-15",
    "inspection_type": "Routine Food Establishment Inspection",
    "inspection_result": "pass",
    "result_basis": "status='Approved'; operational_status='Open' -> pass",
    "score": null,
    "grade": null,
    "critical_violation_count": null,
    "total_violation_count": null,
    "violations": [],
    "geography": {
      "county_name": "Bernalillo",
      "county_fips": "35001",
      "state_fips": "35",
      "state": "NM",
      "population": 676000,
      "population_vintage": "ACS 2019-2023 5-year total population (B01003_001E)",
      "enrichment_note": null
    },
    "source_metadata": {
      "source_name": "City of Albuquerque \u2014 Consumer Health Protection Weekly Media Report",
      "publisher": "City of Albuquerque Environmental Health Department",
      "landing_url": "https://www.cabq.gov/environmentalhealth/food-safety/restaurant-inspection-results",
      "extraction_method": "pdf",
      "source_dataset_id": null,
      "extracted_at": "2026-10-26T17:02:18.417121Z"
    },
    "ingested_at": "2026-10-26T17:02:34.743036Z"
  },
  {
    "schema_version": "0.1.0",
    "inspection_uuid": "2ea70129-d2c7-5fa0-8905-ce2eabdf80c3",
    "establishment_uuid": "55ee55f8-6040-5884-bbdb-92c362156d41",
    "source": "albuquerque_city",
    "source_inspection_id": "PT0054679|2026-10-14|COM-FOODES-097431-2026",
    "source_establishment_id": "PT0054679",
    "restaurant_name": "AMERICAN LEGION POST 100",
    "address": {
      "street": "424 CANDELARIA RD NW",
      "city": "Albuquerque",
      "state": "NM",
      "postal_code": null
    },
    "inspection_date": "2026-10-14",
    "inspection_type": "Complaint Food Establishment Inspection",
    "inspection_result": "pass",
    "result_basis": "status='Conditional Approved'; operational_status='Open' -> pass",
    "score": null,
    "grade": null,
    "critical_violation_count": null,
    "total_violation_count": null,
    "violations": [],
    "geography": {
      "county_name": "Bernalillo",
      "county_fips": "35001",
      "state_fips": "35",
      "state": "NM",
      "population": 676000,
      "population_vintage": "ACS 2019-2023 5-year total population (B01003_001E)",
      "enrichment_note": null
    },
    "source_metadata": {
      "source_name": "City of Albuquerque \u2014 Consumer Health Protection Weekly Media Report",
      "publisher": "City of Albuquerque Environmental Health Department",
      "landing_url": "https://www.cabq.gov/environmentalhealth/food-safety/restaurant-inspection-results",
      "extraction_method": "pdf",
      "source_dataset_id": null,
      "extracted_at": "2026-10-26T17:02:18.417121Z"
    },
    "ingested_at": "2026-10-26T17:02:34.743106Z"
  },
  {
    "schema_version": "0.1.0",
    "inspection_uuid": "1313729a-2d07-51d9-bca6-70e3127c97c4",
    "establishment_uuid": "6a21ecaf-3ed4-58f6-9dd6-ffc4a5cb0306",
    "source": "albuquerque_city",
    "source_inspection_id": "PT0132540|2026-10-15|RT-FOODEST-001372-2026",
    "source_establishment_id": "PT0132540",
    "restaurant_name": "BEGINNING STEPS DAYCARE INC",
    "address": {
      "street": "6521 PARADISE BLVD NW, A",
      "city": "Albuquerque",
      "state": "NM",
      "postal_code": null
    },
    "inspection_date": "2026-10-15",
    "inspection_type": "Routine Food Establishment Inspection",
    "inspection_result": "pass",
    "result_basis": "status='Approved'; operational_status='Open' -> pass",
    "score": null,
    "grade": null,
    "critical_violation_count": null,
    "total_violation_count": null,
    "violations": [],
    "geography": {
      "county_name": "Bernalillo",
      "county_fips": "35001",
      "state_fips": "35",
      "state": "NM",
      "population": 676000,
      "population_vintage": "ACS 2019-2023 5-year total population (B01003_001E)",
      "enrichment_note": null
    },
    "source_metadata": {
      "source_name": "City of Albuquerque \u2014 Consumer Health Protection Weekly Media Report",
      "publisher": "City of Albuquerque Environmental Health Department",
      "landing_url": "https://www.cabq.gov/environmentalhealth/food-safety/restaurant-inspection-results",
      "extraction_method": "pdf",
      "source_dataset_id": null,
      "extracted_at": "2026-10-26T17:02:18.417121Z"
    },
    "ingested_at": "2026-10-26T17:02:34.743176Z"
  },
  {
    "schema_version": "0.1.0",
    "inspection_uuid": "3ae82ebb-343e-5fc0-ae0b-b3140396730d",
    "establishment_uuid": "9a2e11c1-68fb-5596-9bef-59b1fbda9dca",
    "source": "albuquerque_city",
    "source_inspection_id": "PT0158097|2026-10-16|PT0158097",
    "source_establishment_id": "PT0158097",
    "restaurant_name": "DUTCH BROS COFFEE",
    "address": {
      "street": "9600 UNIVERSE BLVD NW",
      "city": "Albuquerque",
      "state": "NM",
      "postal_code": null
    },
    "inspection_date": "2026-10-16",
    "inspection_type": "Routine Food Establishment Inspection",
    "inspection_result": "pass",
    "result_basis": "status='Approved'; operational_status='Open' -> pass",
    "score": null,
    "grade": null,
    "critical_violation_count": null,
    "total_violation_count": null,
    "violations": [],
    "geography": {
      "county_name": "Bernalillo",
      "county_fips": "35001",
      "state_fips": "35",
      "state": "NM",
      "population": 676000,
      "population_vintage": "ACS 2019-2023 5-year total population (B01003_001E)",
      "enrichment_note": null
    },
    "source_metadata": {
      "source_name": "City of Albuquerque \u2014 Consumer Health Protection Weekly Media Report",
      "publisher": "City of Albuquerque Environmental Health Department",
      "landing_url": "https://www.cabq.gov/environmentalhealth/food-safety/restaurant-inspection-results",
      "extraction_method": "pdf",
      "source_dataset_id": null,
      "extracted_at": "2026-10-26T17:02:18.417121Z"
    },
    "ingested_at": "2026-10-26T17:02:34.743228Z"
  },
  {
    "schema_version": "0.1.0",
    "inspection_uuid": "afbd1a7a-f780-523e-a596-843b1cf7eec4",
    "establishment_uuid": "b13c519a-408d-53d2-a603-47300a77992e",
    "source": "albuquerque_city",
    "source_inspection_id": "PT0044799|2026-10-14|COM-FOODES-097292-2026",
    "source_establishment_id": "PT0044799",
    "restaurant_name": "FLYING STAR 3",
    "address": {
      "street": "8001 MENAUL BLVD NE",
      "city": "Albuquerque",
      "state": "NM",
      "postal_code": null
    },
    "inspection_date": "2026-10-14",
    "inspection_type": "Complaint Food Establishment Inspection",
    "inspection_result": "pass",
    "result_basis": "status='Approved'; operational_status='Open' -> pass",
    "score": null,
    "grade": null,
    "critical_violation_count": null,
    "total_violation_count": null,
    "violations": [],
    "geography": {
      "county_name": "Bernalillo",
      "county_fips": "35001",
      "state_fips": "35",
      "state": "NM",
      "population": 676000,
      "population_vintage": "ACS 2019-2023 5-year total population (B01003_001E)",
      "enrichment_note": null
    },
    "source_metadata": {
      "source_name": "City of Albuquerque \u2014 Consumer Health Protection Weekly Media Report",
      "publisher": "City of Albuquerque Environmental Health Department",
      "landing_url": "https://www.cabq.gov/environmentalhealth/food-safety/restaurant-inspection-results",
      "extraction_method": "pdf",
      "source_dataset_id": null,
      "extracted_at": "2026-10-26T17:02:18.417121Z"
    },
    "ingested_at": "2026-10-26T17:02:34.743277Z"
  },
  {
    "schema_version": "0.1.0",
    "inspection_uuid": "3ee9b960-fe03-55b5-91e2-271ff07bc0b0",
    "establishment_uuid": "7b9713ac-2fc0-5e30-be72-745e1afa6229",
    "source": "albuquerque_city",
    "source_inspection_id": "PT0161218|2026-10-16|CAC-Food-098577-2026",
    "source_establishment_id": "PT0161218",
    "restaurant_name": "HERENCIA",
    "address": {
      "street": "11225 MONTGOMERY BLVD NE, D",
      "city": "Albuquerque",
      "state": "NM",
      "postal_code": null
    },
    "inspection_date": "2026-10-16",
    "inspection_type": "Corrective Action Compliance",
    "inspection_result": "pass",
    "result_basis": "status='Approved'; operational_status='Open' -> pass",
    "score": null,
    "grade": null,
    "critical_violation_count": null,
    "total_violation_count": null,
    "violations": [],
    "geography": {
      "county_name": "Bernalillo",
      "county_fips": "35001",
      "state_fips": "35",
      "state": "NM",
      "population": 676000,
      "population_vintage": "ACS 2019-2023 5-year total population (B01003_001E)",
      "enrichment_note": null
    },
    "source_metadata": {
      "source_name": "City of Albuquerque \u2014 Consumer Health Protection Weekly Media Report",
      "publisher": "City of Albuquerque Environmental Health Department",
      "landing_url": "https://www.cabq.gov/environmentalhealth/food-safety/restaurant-inspection-results",
      "extraction_method": "pdf",
      "source_dataset_id": null,
      "extracted_at": "2026-10-26T17:02:18.417121Z"
    },
    "ingested_at": "2026-10-26T17:02:34.743323Z"
  },
  {
    "schema_version": "0.1.0",
    "inspection_uuid": "d3e48a2f-ef97-53c3-bde3-7f8fb0f425c8",
    "establishment_uuid": "7b9713ac-2fc0-5e30-be72-745e1afa6229",
    "source": "albuquerque_city",
    "source_inspection_id": "PT0161218|2026-10-16|RT-FOODEST-022490-2025",
    "source_establishment_id": "PT0161218",